{
  "iss": "https://broker.acme.example",
  "sub": "did:opena2a:agent:acme/orders-reader",
  "aud": "https://api.orders.internal",
  "scope": "orders.read",
  "trust_class": "acme.com/orders:read",
  "issuer_chain": [
    "did:opena2a:authority:opena2a.org"
  ],
  "trust_level": 4,
  "authorization_details": [
    {
      "type": "https://specs.opena2a.org/aap/types/data",
      "locations": [
        "https://api.orders.internal/orders"
      ],
      "actions": [
        "read"
      ],
      "fieldsAllowed": [
        "id",
        "status",
        "total"
      ],
      "fieldsDenied": [
        "customer.email"
      ],
      "labelCeiling": [
        "internal"
      ]
    },
    {
      "type": "https://specs.opena2a.org/aap/types/budget",
      "maxUses": 100,
      "rate": {
        "max": 60,
        "windowSeconds": 60
      }
    }
  ],
  "aap_crit": [
    "authorization_details",
    "cnf"
  ],
  "cnf": {
    "jkt": "HlHgCcjrhbeyw80VMef51yPwhyRqjiwLdwSLRqo7hSI"
  },
  "iat": 1780315200,
  "exp": 1780315500,
  "jti": "c3d4e5f6a7b8091a2b3c4d5e6f708192"
}
